sentence_id,kankanaey,english
891,"Din anak, itdoam si obla ta nininas pangad-adalan da.",Teach children about work so they will gradually learn.
892,Aw ngin.,Maybe so.
893,Ngisiwan yo ta omali da ay dagos.,Whistle at them so that they will come immediately.
894,Ay en ka makisida ed Tacadang?,Will you go attend the feast in Tacadang?
895,Manngaotoy din danan tan nan-odan.,The path is slippery because it rained.
896,Intoy ngalngalaten da di?,What are they talking about?
897,Nginalat kos sis-iya yan adi sinosombat.,I talked to her and she never answered.
898,Sinoy laydem ay ingadan sin moyang?,What do you want to name the child?
899,Ingadan yo iman di sigsig-ed ay ngadan.,Name her with a very nice name.
900,Kalingeb din liboo sin ngabangab di bowan.,The clouds suddenly covered the light of the moon.
901,Nay di pilak ay indawat mo en sak-en.,Here is the money you gave me.
902,Naoney di baknang ay mangan si mam-is ay makan.,A rich person who eats tasty food is lucky.
903,Namowawet adi mo makakali kamis Kankanaey.,It's indeed good if we are able to speak Kankanaey.
904,Masapol kayman ay nam-osen yo di nankikinalasi ay ligat.,You must admittedly suffer various kinds of hardship.
905,"Magay nam-osen si boway, tan manlogan tako.","No fatigue will be endured, because we will ride."
906,"Namnamaek ay din maikadwa ay bowan, temeg-in.","I expect that the second month, it will get cold."
907,Manam-ay sa ay maadal.,That is easy to learn.
908,Kaman dan kanan en nabaew di otot en amam.,"It's as if they've said (i.e., it seems that I've heard) that your father died."
909,Naadal ka ket. Apay nga adi ka ammo di ibagak?,You're certainly educated. Why don't you know what I'm talking about?
910,Dinmateng kami sin kosto ay mansegep di manok.,We arrived at the very time the chickens go to roost.
911,Namansaan din badok.,My clothes are stained.
912,Ilam tan mamikmik tinapay kos na.,Watch out because my bread here will be squashed.
913,"Mo adi yo patpatien, dakayo met laeng di madosa.","If you don't obey, you are the very ones who will be punished."
914,"Olay mo man-odan, emeyak met laeng.","Even though it rains, I'll go just the same."
915,Ay inam din bola?,Did you take the ball?
916,Pasgepem din mangili ay sana.,Have that visitor come in.
917,Namagmagan din danom sin sakdoan.,The water is empty at the water source.
918,Man-a kas papil ta say ilop-it mo pangipay-am tan nay magay sopot.,"Get some paper and fold it up to make a place in which to put it, because there's no bag."
919,Ay niliknam di yegyeg?,Did you feel an earthquake?
920,Mailigligatan ay man-isbo.,He is having a hard time urinating.
921,Naligat ay mantikid mo man-atong.,It's difficult to climb uphill when it's hot.
922,"Ilid-ip mo, peteg di soyop mo.","Take a nap, you're overly sleepy."
923,Nabotan mata na yan inlekleleklek na.,He had something in his eye and kept rubbing it.
924,Ilkeb ko sin nabisngit ay pantalon.,I'll use it to patch the torn pants.
925,Nailebleb din kamerak sin nan-agadangak sin ginawang.,My camera was immersed when I crossed the river.
926,Say inyat na kanos sa ay linbeng Apo Diyos din daga.,"That's how it happened, they say, that God flooded the earth."
927,"Ten-em, adim lebasen asin.","Take it easy, don't overdo the salt."
928,Dalasen tako tan ilbas dan tapey.,Let's hurry because they'll drink up all the rice beer.
929,Ilayawam mo seppaten daka.,Run away from him if he beats you.
930,Inlayaw da din ayam Bitnak.,They ran off with Bitnak's toy.
931,"Adi makalaon din pitati, tan nasobla.","The market bag can not hold it, because it's too much."
932,Pigay nilaon diblom ay nay si istolya?,How many stories does this book of yours contain?
933,Ilaok mo din patpatok sin pising.,Mix in the meat with the gabi leaves.
934,Alaem san jakit ta ilaob ko sin badok.,Get that jacket for me to put on over my shirt.
935,Aket anggay lam-eden di alam mo?,How come you are taking such a large amount?
936,Nilak-am koy dagaang sin inmeyak ed Tacadang.,I experienced hunger when I went to Tacadang.
937,Malakay kaiw ed gowab.,There are many trees down the hill.
938,Sigaana ay mailabosan.,The snake is hiding.
939,Ilabosan yos sis-iya ta emsen tako.,Take off his clothes for him so that we can bathe him.
940,Nalabes ay naom san balat.,Those bananas are overly ripe.
941,Ipalabaw mo sin innapoy.,Put it on top of the cooked rice.
942,Kilisam book na ta maanaptik.,Trim his hair so it will all be shortened.
943,Mankilangak si kapi si bigat ta wada di kapien tako.,I will roast coffee tomorrow so we have some coffee to drink.
944,Kikinboong din kido.,The thunder made a loud crashing sound.
945,Mankinaw-it din kawal.,The chains are hooked together.
946,Ikaw-iding mon sis-iya.,Link arms with her.
947,Wada di dakdake ay ginawang ay makwani en Matuno.,There is a large river called Matuno.
948,Ikatawanak tan Kankanaey di ammok.,I'm from a Kankanaey-speaking area because Kankanaey is what I know.
949,Mangatawanak tan say inadal ko ed Kibungan.,I speak Kankanaey because that's what I learned in Kibungan.
950,Kakat kano din ason en Bilyot en Adan.,Bilyot's dog reportedly suddenly bit Adan.
951,Adi komat din aso.,The dog won't bite.
952,Ilaem tan mankat sa.,Watch out because that one bites.
953,Nabanglo di kasongsongan di sabsabong.,The flowers have a fragrant scent.
954,Ay laydem ay ed Baguio di mabistigalan di kasom?,Do you want your case to be tried in Baguio?
955,Apay nga adi kayon omikaskaso?,Why don't you pay attention to me?
956,Adi inkaskason din opisyal din kedkedawen di nabibiteg.,The official didn't pay attention to what the poor people were requesting.
957,Adiak inkaskason odan tan laydek ay kedngen oblak.,I didn't heed the rain because I wanted to finish my work.
958,Ikasin mo din dadakke sin kinittoy.,Separate the large from the small.
959,Laydelayden din esay nakay din kasinan nakay.,The one old man really likes the other old man.
960,Binmaba kasin din lakon di dipolyo.,The price of cabbage has gone down again.
961,En da ikasaba din kalin Jesus sin ipogaw.,They are going to preach the words of Jesus to the people.
962,Komapoy ka mo adi ka mangan.,You will become weak if you don't eat.
963,Abaem nan mansakit ay anak tan nay makmakapoy ay mandan.,Carry this sick child on your back because he is presently too weak to walk.
964,"Anggan owat kan kaposan, tan madagsen kayman.","Why don't you just fill it close to the top, because admittedly it's heavy."
965,Anggay nankapos din bowan.,The month is almost over already.
966,Owat kapos na ay nakdeng.,Only a little bit of it is finished.
967,Into pay isna di kapian en Luisa.,Where here (in this town) is Luisa's coffee place?
968,Ad-adoy ipogaw di nangikap-eng sin doy dipolyo.,Many people received an equal share of that cabbage.
969,Ilam tan kaoten dan bolsikom.,Watch out because they'll reach inside your pocket.
970,Emey kayo kano si bigat.,Someone said you are going tomorrow.
971,"Ed nabaon kano, sin-gagayyem di ipogaw ya bowaya.","Long ago, they say, people and crocodiles were friends."
972,Ikankanaey mo kod ta maawatan din anan-ak.,Please say it in Kankanaey so the children will understand.
973,Ammom baw ay mangankanaey!,So you know how to speak Kankanaey!
974,Sino din kangalngalat mo ay doy?,Who is that person to whom you are speaking?
975,"Emeyak ed Bakun, pagak ikanayon ed Palina.","I will go to Bakun, then I will go on to Palina."
976,Ay naisagana din makan?,Has the food been prepared?
977,Nakameleng din gatin di aso.,The dog tracks had claw marks.
978,Kinameleng din posa din tamil ko.,The cat clawed my cheek.
979,Ikamang mo ay somaa.,Go home early.
980,Adi ka paandoem san kalim.,Don't make your speech any longer.
981,Magay inil-ila mis kaman nina.,We have never seen anything like this.
982,Mabainak mo mankamaliak.,I am embarrassed if I make a mistake.
983,Ikamakam ko ay manlaba.,I am hurrying to finish up the laundering.
984,Makalsikalsig nan daga.,This earth is divided up into many areas.
985,Nakaloskos din ipogaw sin deppas ay dinana.,The person fell down the cliff along which he walked.
986,Kal-inem san patpatok.,Turn over that meat.
987,Gominek ka kod ta sak-en di komali.,Kindly be quiet so that I will be the one to speak.
988,Naikalat bonag da.,Their possessions are scattered in various places.
989,Ad-adoy kalasin di lokto.,There are many kinds of sweet potato.
990,Pig-an di kakdengan di anim?,When will your harvest end?
991,Kagkagosana ay omali.,He is hurrying to come.
992,Alaem din kagiyodan.,Get the smallest.
993,Sinoy kadlon mo?,Who is the person next to you?
994,Sino di kadwa mi ay emey ed Bagabag?,Who will be our companions to go to Bagabag?
995,Sinoy kadakdaken di kabayo?,What is the size of the horse?
996,Ikaan mo sa gogon-a ta mandanak.,Take that away first so that I can walk through.
997,Adi ka kod pakaanen dakami isnan ili ay nay.,Please don't make us leave this town.
998,Tomolong ka mo way kaasim.,Help me if you have mercy.
999,"Napnek di ay ipogaw, baken talantado.","That is a trustworthy person, not careless."
1000,Kaanem sinilas mo ta asi ka senggep.,Take off your shoes before you come in.
